<?xml version="1.0" encoding="ISO-8859-1"?>
<!DOCTYPE metamoduledesc  SYSTEM "http://flowvr.sf.net/flowvr-parse/dtd/metamoduledesc.dtd" >
<metamoduledesc>
<metamoduledescription>
<run>flowvr-run-ssh -p -e DISPLAY <template id="display">${DISPLAY:-:0}</template> '<hostlist />' vtk <template id="script"/> <template id="args"/></run>
<modulelist>
  <script shell="/bin/bash">
count=0;
for h in <hostlist/>;
do
    echo "  &lt;module id=\"<metamoduleid/>/$count\" host=\"$h\"&gt;";
    echo '    &lt;input&gt;';
    for i in <template id="inputs">beginIt</template>;
    do
      echo "      &lt;port id=\"$i\"&gt;";
      echo '      &lt;datatype/&gt;';
      echo '      &lt;/port&gt;';
    done
    echo '    &lt;/input&gt;';
    echo '    &lt;output&gt;';
    for i in <template id="outputs">endIt</template>;
    do
      echo "      &lt;port id=\"$i\"&gt;";
      echo '      &lt;datatype/&gt;';
      echo '      &lt;/port&gt;';
    done
    echo '    &lt;/output&gt;';
    echo '  &lt;/module&gt;';
let count+=1;
done
  </script>
</modulelist>
</metamoduledescription>
</metamoduledesc>
